[
  {
    "receipt_id": "rcpt-0001",
    "trip_id": "trip-0001",
    "employee_alias": "employee-001",
    "date": "2026-05-11",
    "category": "hotel",
    "vendor": "Northwind Grand Hotel Osaka",
    "currency": "JPY",
    "amount": 14500,
    "amount_jpy": 14500,
    "has_image": true,
    "note": "domestic_tier1 上限(15,000円)内"
  },
  {
    "receipt_id": "rcpt-0002",
    "trip_id": "trip-0001",
    "employee_alias": "employee-001",
    "date": "2026-05-11",
    "category": "ground_transport",
    "vendor": "Woodgrove Taxi",
    "currency": "JPY",
    "amount": 1200,
    "amount_jpy": 1200,
    "has_image": true,
    "note": "22時以降、終電なしのため利用"
  },
  {
    "receipt_id": "rcpt-0003",
    "trip_id": "trip-0002",
    "employee_alias": "employee-002",
    "date": "2026-06-01",
    "category": "flight",
    "vendor": "Contoso Air",
    "currency": "JPY",
    "amount": 32000,
    "amount_jpy": 32000,
    "has_image": true,
    "note": "東京-福岡 往復エコノミー"
  },
  {
    "receipt_id": "rcpt-0004",
    "trip_id": "trip-0002",
    "employee_alias": "employee-002",
    "date": "2026-06-02",
    "category": "hotel",
    "vendor": "Tailspin Hotel Fukuoka",
    "currency": "JPY",
    "amount": 11800,
    "amount_jpy": 11800,
    "has_image": true,
    "note": "domestic_tier1 上限(15,000円)内"
  },
  {
    "receipt_id": "rcpt-0005",
    "trip_id": "trip-0003",
    "employee_alias": "employee-003",
    "date": "2026-07-10",
    "category": "flight",
    "vendor": "Fabrikam Airlines",
    "currency": "USD",
    "amount": 4200,
    "amount_jpy": 630000,
    "has_image": true,
    "note": "東京-ニューヨーク往復ビジネス。VP事前承認済みを想定した架空データ"
  },
  {
    "receipt_id": "rcpt-0006",
    "trip_id": "trip-0003",
    "employee_alias": "employee-003",
    "date": "2026-07-11",
    "category": "hotel",
    "vendor": "Northwind Grand Hotel New York",
    "currency": "USD",
    "amount": 165,
    "amount_jpy": 24750,
    "has_image": true,
    "note": "international_tier_a 上限(25,000円)内"
  },
  {
    "receipt_id": "rcpt-0007",
    "trip_id": "trip-0003",
    "employee_alias": "employee-003",
    "date": "2026-07-12",
    "category": "other",
    "vendor": "Contoso Exhibition Services",
    "currency": "USD",
    "amount": 300,
    "amount_jpy": 45000,
    "has_image": false,
    "note": "展示ブース什器レンタル。紛失申告書による精算上限5,000円のみ対象。残額40,000円は別途例外承認が必要な架空データ"
  },
  {
    "receipt_id": "rcpt-0008",
    "trip_id": "trip-0004",
    "employee_alias": "employee-004",
    "date": "2026-05-20",
    "category": "flight",
    "vendor": "Fabrikam Airlines",
    "currency": "JPY",
    "amount": 58000,
    "amount_jpy": 58000,
    "has_image": true,
    "note": "東京-シンガポール往復プレミアムエコノミー"
  },
  {
    "receipt_id": "rcpt-0009",
    "trip_id": "trip-0004",
    "employee_alias": "employee-004",
    "date": "2026-05-21",
    "category": "hotel",
    "vendor": "Tailspin Hotel Singapore",
    "currency": "SGD",
    "amount": 240,
    "amount_jpy": 26400,
    "has_image": true,
    "note": "international_tier_b 上限(20,000円)を超過。マネージャー事前承認済みを想定した架空データ"
  },
  {
    "receipt_id": "rcpt-0010",
    "trip_id": "trip-0005",
    "employee_alias": "employee-005",
    "date": "2026-08-03",
    "category": "flight",
    "vendor": "Contoso Air",
    "currency": "JPY",
    "amount": 28000,
    "amount_jpy": 28000,
    "has_image": true,
    "note": "大阪-札幌往復エコノミー"
  },
  {
    "receipt_id": "rcpt-0011",
    "trip_id": "trip-0006",
    "employee_alias": "employee-006",
    "date": "2026-09-01",
    "category": "flight",
    "vendor": "Fabrikam Airlines",
    "currency": "GBP",
    "amount": 3100,
    "amount_jpy": 589000,
    "has_image": true,
    "note": "東京-ロンドン往復ビジネス。VP事前承認済みを想定した架空データ"
  },
  {
    "receipt_id": "rcpt-0012",
    "trip_id": "trip-0006",
    "employee_alias": "employee-006",
    "date": "2026-09-02",
    "category": "hotel",
    "vendor": "Northwind Grand Hotel London",
    "currency": "GBP",
    "amount": 130,
    "amount_jpy": 24700,
    "has_image": true,
    "note": "international_tier_a 上限(25,000円)内"
  },
  {
    "receipt_id": "rcpt-0013",
    "trip_id": "trip-0007",
    "employee_alias": "employee-007",
    "date": "2026-05-25",
    "category": "flight",
    "vendor": "Fabrikam Airlines",
    "currency": "HKD",
    "amount": 4800,
    "amount_jpy": 91200,
    "has_image": true,
    "note": "東京-香港往復エコノミー"
  },
  {
    "receipt_id": "rcpt-0014",
    "trip_id": "trip-0008",
    "employee_alias": "employee-008",
    "date": "2026-06-15",
    "category": "ground_transport",
    "vendor": "Woodgrove Taxi",
    "currency": "JPY",
    "amount": 3400,
    "amount_jpy": 3400,
    "has_image": false,
    "note": "重量機材運搬のため利用。領収書紛失のため紛失申告書で対応(規程の上限額の適用対象)"
  }
]
